{"voice":"peer-cursor","cross_model_route":"cursor","cross_model_target":"cursor","cross_model_harness":"cursor-agent","serving_family":"unknown","model_requested":"auto","model_actual":"unverified","independence_verified":false,"position":"Hold: the adapter interface is pinned but the migration changes retry semantics.","reasoning":"src/client.ts:30 retries on 5xx; the new SDK retries on 4xx too.","evidence":["src/client.ts:30"],"external_check":"unavailable","mode":"skeptic","movement":"initial","final":true}
