{"voice":"peer-codex","cross_model_route":"codex","cross_model_target":"codex","cross_model_harness":"codex","serving_family":"codex","model_requested":"gpt-6.1-sol","model_actual":"unverified","independence_verified":true,"position":"Adopt: the migration is low-risk because the adapter boundary already isolates the client.","reasoning":"The only caller is src/client.ts and its tests pin the adapter interface.","evidence":["src/client.ts:12","tests/client.test.ts:40"],"external_check":"unavailable","mode":"independent","movement":"initial","final":true}
